course,comparison_with_competitors,benchmarking_against_similar_courses
Psychology,"Similar content, competitive pricing",Average enrollment rate compared to similar courses
Organic Chemistry I,"Advanced curriculum, higher tuition",Higher completion rates compared to similar courses
Computer Science,"Cutting-edge technology focus, renowned faculty",Higher job placement rates compared to similar courses
Principles of Microeconomics,"Comprehensive coverage, diverse faculty",Similar average grades compared to similar courses
English Composition I,"Strong emphasis on writing skills, innovative teaching methods",Higher student satisfaction compared to similar courses
Mathematics,"Rigorous curriculum, challenging assignments",Similar dropout rates compared to similar courses
Sociology,"Interactive learning environment, diverse perspectives",Higher retention rates compared to similar courses
Principles of Marketing,"Practical applications, industry connections",Higher average salaries post-graduation compared to similar courses
Physics,"Emphasis on problem-solving, research opportunities",Similar student engagement levels compared to similar courses
Spanish Language and Culture I,"Immersive learning experiences, study abroad opportunities",Higher language proficiency outcomes compared to similar courses
Art and Design,"Extensive course material, renowned faculty",Similar completion rates compared to similar courses
Environmental Science,"Hands-on fieldwork opportunities, sustainability focus",Higher student engagement levels compared to similar courses
Political Science,"In-depth analysis, guest lectures",Similar participation rates in extracurricular activities compared to similar courses
French,"Interactive language labs, cultural immersion activities",Higher average grades compared to similar courses
Music,"Comprehensive music curriculum, performance opportunities",Similar satisfaction rates among music majors compared to similar courses
Anthropology,"Anthropological fieldwork, global perspective",Higher employment rates in anthropology-related fields compared to similar courses
Engineering,"Hands-on projects, industry partnerships",Similar research output compared to similar courses
Computer Networks,"Cutting-edge technology focus, networking opportunities",Higher certification rates compared to similar courses
Philosophy,"Critical thinking emphasis, philosophical debates",Similar enrollment rates in advanced philosophy courses compared to similar courses
Digital Marketing,"Industry-relevant curriculum, case study analysis",Higher digital marketing campaign success rates compared to similar courses
